sp3/perf/Cijk_Alik_Bljk_HBH_MT64x64x32_SE_.csv
,KernelName,M,N,C,K,GFlops,Efficiency
0,Cijk_Alik_Bljk_HBH_MT64x128x32_SE_,960,1024,1,1024,42799.02,45.949777890006594
1,Cijk_Alik_Bljk_HBH_MT64x128x32_SE_,1920,2048,1,2048,51755.07,55.56515011749671
2,Cijk_Alik_Bljk_HBH_MT64x128x32_SE_,3840,4096,1,4096,51056.19,54.814820302193276
3,Cijk_Alik_Bljk_HBH_MT64x128x32_SE_,7680,8192,1,8192,54084.36,58.06591668040898
