sp3/perf/Cijk_Alik_Bljk_HBH_MT64x128x32_SE_.csv
,KernelName,M,N,C,K,GFlops,Efficiency
0,Cijk_Alik_Bljk_HBH_MT64x128x32_SE_,960,1024,1,1024,43240.25,46.42349015020339
1,Cijk_Alik_Bljk_HBH_MT64x128x32_SE_,1920,2048,1,2048,52758.72,56.64268634564644
2,Cijk_Alik_Bljk_HBH_MT64x128x32_SE_,3840,4096,1,4096,50338.19,54.04396291982741
3,Cijk_Alik_Bljk_HBH_MT64x128x32_SE_,7680,8192,1,8192,54011.36,57.98754260114336
